artwork	subject
http://yago-knowledge.org/resource/Laocoön_(El_Greco)	painting
http://yago-knowledge.org/resource/Faith_(painting)	painting by Piero del Pollaiolo
http://yago-knowledge.org/resource/Flaying_of_Marsyas_(Titian)	painting by Titian
http://yago-knowledge.org/resource/Fortitude_(Botticelli)	painting by Sandro Botticelli in the Uffizi
http://yago-knowledge.org/resource/Jimson_Weed_(painting)	painting by Georgia O'Keeffe
http://yago-knowledge.org/resource/Madonna_and_Child_with_an_Apple	painting by Carlo Crivelli in the Victoria and Albert Museum
http://yago-knowledge.org/resource/Man_and_Woman_Contemplating_the_Moon	painting by Caspar David Friedrich
http://yago-knowledge.org/resource/Mary_Magdalene_(Artemisia_Gentileschi)	painting by Artemisia Gentileschi
http://yago-knowledge.org/resource/Mystic_Marriage_of_St._Catherine_(Memling)	painting by Hans Memling
http://yago-knowledge.org/resource/Portrait_of_Giuliano_de'_Medici_(Botticelli,_Berlin)	portrait by Sandro Botticelli in the Gemäldegalerie, Berlin
http://yago-knowledge.org/resource/Self-Portrait_in_Tuxedo_Q2267583	painting by Max Beckmann
http://yago-knowledge.org/resource/Stigmate_of_Saint_Francis_Q3973585	painting of the Maestro della Croce 434 in the Uffizi
http://yago-knowledge.org/resource/The_Empress_Eugenie_Surrounded_by_her_Ladies_in_Waiting_Q3937441	painting by Franz Xaver Winterhalter
http://yago-knowledge.org/resource/_Q3977127	painting by Giorgione
http://yago-knowledge.org/resource/_Q5826944	painting by Annibale Carracci
http://yago-knowledge.org/resource/_Q60430871	painting by Georges Braque
http://yago-knowledge.org/resource/_Q60432577	painting by Georges Braque
http://yago-knowledge.org/resource/_Q60454884	painting by Pablo Picasso
http://yago-knowledge.org/resource/_Q60575803	painting by Marc Chagall
http://yago-knowledge.org/resource/_Q60621565	painting by René Magritte
http://yago-knowledge.org/resource/Mademoiselle_Caroline_Rivière	1806 portrait by Jean Auguste Dominique Ingres
http://yago-knowledge.org/resource/Mademoiselle_Rose	painting by Eugène Delacroix
http://yago-knowledge.org/resource/Madonna_and_Child_Q15935036	painting by Sandro Botticelli in the Louvre
http://yago-knowledge.org/resource/Madonna_and_Child_with_the_Young_St._John_the_Baptist_Q9500247	painting by Sandro Botticelli in the Louvre
http://yago-knowledge.org/resource/Marriage_of_the_Virgin_(Giordano)	painting by Luca Giordano
http://yago-knowledge.org/resource/Moses_Striking_the_Rock_Q11784786	painting by Jan Steen
http://yago-knowledge.org/resource/Orphan_Girl_at_the_Cemetery	painting by the French artist Eugène Delacroix
http://yago-knowledge.org/resource/Portrait_of_a_Elderly_Lady_Q11945393	painting by Hans Memling
http://yago-knowledge.org/resource/Portrait_of_an_Old_Woman_with_Folded_Hands	painting by Style of Jacob Backer
http://yago-knowledge.org/resource/Portrait_of_Andrea_Odoni	painting by Lorenzo Lotto
http://yago-knowledge.org/resource/Portrait_of_Émilie_Sériziat_and_Her_Son_Q3399409	painting by Jacques-Louis David
http://yago-knowledge.org/resource/Portrait_of_Maerten_Soolmans_Q19421105	painting by Rembrandt
http://yago-knowledge.org/resource/Adoration_of_the_Magi_(Veronese)	painting by Paolo Veronese in the National Gallery, London
http://yago-knowledge.org/resource/Christ_in_the_House_of_Martha_and_Mary_(Vermeer)	painting by Johannes Vermeer
http://yago-knowledge.org/resource/Ginevra_de'_Benci	painting by Leonardo da Vinci
http://yago-knowledge.org/resource/Improvisation_27_(Garden_of_Love_II)_Q19919146	painting by Vasily Kandinsky
http://yago-knowledge.org/resource/Interior_(Degas)	painting by Edgar Degas
http://yago-knowledge.org/resource/Madonna_and_Child_(Lippi)	painting by Filippo Lippi in the Uffizi
http://yago-knowledge.org/resource/Portrait_of_Cosimo_il_Vecchio_Q3937502	painting by Pontormo in the Uffizi
http://yago-knowledge.org/resource/Portrait_of_Fray_Hortensio_Félix_Paravacino	painting by El Greco
http://yago-knowledge.org/resource/Portrait_of_Marchesa_Brigida_Spinola-Doria	painting by Peter Paul Rubens
http://yago-knowledge.org/resource/Self-Portrait_(Inn_of_the_Dawn_Horse)	painting by Leonora Carrington
http://yago-knowledge.org/resource/_Q6106790	painting by Jean-Honoré Fragonard
http://yago-knowledge.org/resource/_Q61482571	painting by Georges Braque (Villeneuve-d'Ascq)
http://yago-knowledge.org/resource/_Q61520711	painting by Joan Miró
http://yago-knowledge.org/resource/A_Bearded_Carmelite_Saint_Q3949530	painting by Masaccio
http://yago-knowledge.org/resource/A_Beardless_Carmelite_Saint_Q3949531	painting by Masaccio
http://yago-knowledge.org/resource/A_Clinical_Lesson_at_the_Salpêtrière	painting by André Brouillet
http://yago-knowledge.org/resource/The_Evening_of_Ashura	painting by Mahmoud Farshchian
http://yago-knowledge.org/resource/The_Fortune_Teller_(de_La_Tour)	painting by Georges de La Tour
http://yago-knowledge.org/resource/The_Last_Drop_(Leyster)	painting by Judith Leyster
http://yago-knowledge.org/resource/Three_Studies_for_a_Crucifixion	painting by Francis Bacon
http://yago-knowledge.org/resource/Two_Men_Contemplating_the_Moon	painting by Caspar David Friedrich, Galerie Neue Meister
http://yago-knowledge.org/resource/White_on_White	painting by Kazimir Malevich
http://yago-knowledge.org/resource/American_Progress	painting by John Gast
http://yago-knowledge.org/resource/Dead_Christ_Supported_by_Angels_(Bellini,_Rimini)	painting by Giovanni Bellini in the City Museum of Rimini
http://yago-knowledge.org/resource/Death_and_the_Miser	painting by Hieronymus Bosch
http://yago-knowledge.org/resource/Frescos_in_the_Oranienbaum,_Russia_(Pittoni)_Q67173476	Frescos by Giambattista Pittoni
http://yago-knowledge.org/resource/The_Accommodations_of_Desire	painting by Salvador Dalí
http://yago-knowledge.org/resource/The_Actor_(painting)	painting by Pablo Picasso
http://yago-knowledge.org/resource/The_Denial_of_Saint_Peter_(Hendrick_ter_Brugghen)	painting by Hendrick ter Brugghen
http://yago-knowledge.org/resource/The_Song_of_Love	painting by the Italian metaphysical painter Giorgio de Chirico
http://yago-knowledge.org/resource/The_Yellow_House	painting by Vincent van Gogh (F464)
http://yago-knowledge.org/resource/Woman_with_a_Pearl_Necklace_in_a_Loge	painting by Mary Cassatt, 1879
http://yago-knowledge.org/resource/Biccherna	painting by Benvenuto di Giovanni
http://yago-knowledge.org/resource/Dante_and_Virgil	painting by William Bouguereau
http://yago-knowledge.org/resource/Ellen_Terry_as_Lady_Macbeth	painting by John Singer Sargent
http://yago-knowledge.org/resource/Francesco_St_Jerome	oil painting on copper by Jacopo Palma the Younger
http://yago-knowledge.org/resource/Les_Demoiselles_d'Avignon	painting by Pablo Picasso
http://yago-knowledge.org/resource/Portrait_of_Marie-Françoise_Rivière	portrait painting by Jean Auguste Dominique Ingres
http://yago-knowledge.org/resource/Portrait_of_Monsieur_Bertin	painting by Jean-Auguste-Dominique Ingres
http://yago-knowledge.org/resource/Portrait_of_Philibert_Rivière	painting by Jean Auguste Dominique Ingres
http://yago-knowledge.org/resource/Projet_d'aménagement_de_la_Grande_Galerie_du_Louvre,_vers_1796_Q15934792	painting by Hubert Robert
http://yago-knowledge.org/resource/Reign_of_Comus_(Lorenzo_Costa)	painting by Lorenzo Costa
http://yago-knowledge.org/resource/Revelry_at_an_Inn_Q11092220	painting by Jan Steen
http://yago-knowledge.org/resource/Roses_in_a_vase_Q16547914	painting by Auguste Renoir
http://yago-knowledge.org/resource/Saying_Grace_(Chardin)	painting by Jean Siméon Chardin, housed at the Hermitage
http://yago-knowledge.org/resource/Self-portrait_with_Green_Vest_Q11907350	painting by Eugène Delacroix
http://yago-knowledge.org/resource/Souvenir_de_Mortefontaine	painting by Jean-Baptiste-Camille Corot
http://yago-knowledge.org/resource/Still_Life_of_a_Lamb's_Head_and_Flanks	painting by Francisco de Goya
http://yago-knowledge.org/resource/Crucifixion_(Mantegna)	central part of the predella of San Zeno altar piece by Andrea Mantegna
http://yago-knowledge.org/resource/Enthroned_Madonna_and_Child_with_two_virgin_martyrs_Q3842546	painting by Cima da Conegliano
http://yago-knowledge.org/resource/Eva_Prima_Pandora_Q3061277	painting by Jean Cousin
http://yago-knowledge.org/resource/Ferdinand-Philippe_d'Orleans_by_Ingres_-_RF_2005-13_Q15727627	painting by Jean-Auguste-Dominique Ingres
http://yago-knowledge.org/resource/Ixion,_King_of_the_Lapiths,_Deceived_by_Juno,_Who_He_Wished_to_Seduce	painting by Peter Paul Rubens
http://yago-knowledge.org/resource/Judith_(Giorgione)	painting by Giorgione in the Eremitage
http://yago-knowledge.org/resource/Las_tres_velas_Q19266867	The three sails (Joaquín Sorolla)
http://yago-knowledge.org/resource/Liberty_Leading_the_People	painting by Eugène Delacroix
http://yago-knowledge.org/resource/Lucretia_(Rembrandt,_1664)	painting by Rembrandt, 1664
http://yago-knowledge.org/resource/Look_Mickey	painting by Roy Lichtenstein
http://yago-knowledge.org/resource/Mademoiselle_V..._in_the_Costume_of_an_Espada	painting by Édouard Manet
http://yago-knowledge.org/resource/Madonna_of_the_Pinks	painting by Raphael
http://yago-knowledge.org/resource/Portrait_of_Karel_van_Mallery_Q50375122	painting by Anton van Dyck
http://yago-knowledge.org/resource/The_City_(Léger)	painting by Fernand Léger
http://yago-knowledge.org/resource/The_Fall_of_Phaeton_(Rubens)	painting by Peter Paul Rubens
http://yago-knowledge.org/resource/The_Midnight_Ride_of_Paul_Revere_(painting)	painting by Grant Wood
http://yago-knowledge.org/resource/The_Prison_of_Copenhagen_Q14951231	painting by Martinus Rørbye
http://yago-knowledge.org/resource/Portrait_of_a_Lady_in_Yellow	painting by Alesso Baldovinetti in the National Gallery, London
http://yago-knowledge.org/resource/Portrait_of_a_Young_Woman_with_a_(Red)_Beret_Q3937756	painting by Albrecht Dürer
http://yago-knowledge.org/resource/Portrait_of_Giuliano_de'_Medici_Q3399442	painting by Sandro Botticelli in the National Gallery of Art, Washington
