artwork	desc
http://data.europeana.eu/proxy/provider/90402/SK_A_1606	"Prometheus stole fire from the gods and gave it to mankind. As punishment, Vulcan chained him to a rock, where an eagle pecked out his liver causing him excruciating pain. Here we see Prometheus being chained, his face contorted with fear, while Mercury laughs at him. Van Baburen borrowed the dramatic illumination and the figure’s sunburned hands and faces from
his great model Caravaggio."
http://data.europeana.eu/proxy/provider/90402/SK_A_2813	"A pewter flagon, a wine glass, an earthenware water jar, a little piece of paper with two music staves and
a didactic inscription, above which hangs a bridle or a rein – these are explicit exhortations to moderation.
Wine must be cut with water; passions must be bridled. This strict message contrasts sharply with the reputation of the artist, who was repeatedly accused of being a whoremonger and a heretic."
http://data.europeana.eu/proxy/provider/90402/SK_A_3162	Corot belonged to the Barbizon School, which was so widely admired by Hague School artists. Around 1840 several artists settled in the village of Barbizon. They worked en plein air (in the open air) and lived among the peasants. Corot made this painting after a trip to Les Landes, a region south of Bordeaux. It was thus formerly entitled Souvenir de Les Landes.
http://data.europeana.eu/proxy/provider/90402/SK_A_4076	Calkoen’s audience with Sultan Ahmed III took place on 14 September 1727 and followed a strict protocol. Here we see the retinue, unarmed according to convention, enter-ing the second courtyard of Topkapı Palace. Audiences were always held on the day that the Janissaries, the elite fighting force, received their pay. Just as Calkoen enters, the soldiers lunge noisily at the dishes of rice.
http://data.europeana.eu/proxy/provider/90402/SK_A_3558	Horses were Breitner’s first subject and remained a life-long passion. This sketch shows how he made a preliminary lay-out of a cityscape. He did this on the spot, using a small panel that fit into the lid of his painter’s box. He depicted the two horses and the horse tram, as well as the contours of the houses, with swift strokes in brown tints over the summary underdrawing.
http://data.europeana.eu/proxy/provider/90402/SK_A_384	"Prince’s Day! This popular feast-day celebrated the birthday (14 November 1650) of Prince William III of
Orange-Nassau. How this was done is explained on the piece of paper on the floor in the middle foreground.
This translates as: ‘To the health of the Nassau laddie, in one hand a rapier, and in the other a glass raised gladly.’ This is sure to boost spirits; the revellers take no notice of the portrait of the prince ‘overlooking’ the scene."
http://data.europeana.eu/proxy/provider/2063625/HU_280_002	This experimental work consists of two parts. The upper section contains strips of raw textile arranged in wave-like patterns, sewn onto a painted white oil surface. On a separate panel, the lower part is an oil-on-canvas painting, its surface mostly taken up by black writing, as an abstract gesture. From the late 1960s, Ilona Keserü carried out experiments to seek new territories for the medium of painting. She used textiles (canvases) to underline the spatial character of her works. As such, this work points in the direction of object art, as it breaks out of two dimensions and steps into three-dimensionality. The contrast between her use of textile and the abstract expressionist gestures underlines the dichotomy of masculine and feminine means of expression in her art.
http://data.europeana.eu/proxy/provider/90402/SK_A_367	"This striking painting is a portrait of a ruler lit only by the flame of a candle. The candle has a symbolic meaning. It serves others with its light, while burning itself out. In other words, self-denial is a noble virtue. William (1650–1702) wears a suit of armour with an
ermine cloak around his neck as a sign of royalty."
http://data.europeana.eu/proxy/provider/90402/SK_A_4	A swan fiercely defends its nest against a dog. In later centuries this scuffle was interpreted as a political allegory: the white swan was thought to symbolize the Dutch statesman Johan de Witt (assassinated in 1672) protecting the country from its enemies. This was the meaning attached to the painting when it became the very first acquisition to enter the Nationale Kunstgalerij (the forerunner of the Rijksmuseum) in 1880.
http://data.europeana.eu/proxy/provider/90402/SK_A_1374	The undecided naval Battle of Dogger Bank in the North Sea against the British (1781) was celebrated as a victory in the Dutch Republic. Under the command of Vice-Admiral Zoutman, the Dutch fleet had finally regained its militancy. Zoutman is portrayed with the decorations he received in gratitude from Stadtholder William V: a gold sword, a Dogger Bank medallion on a ribbon and a medal of honour.
http://data.europeana.eu/proxy/provider/2063607/EST_280_004	Viktor Karrus’s Grain for the State represents a trend that developed under Social Realism, which focused on the depiction of idyllic everyday life and transmitted ideological messages indirectly. The painting illustrates how political art employed the poetry of imagery and how powerful its impact could be.
http://data.europeana.eu/proxy/provider/90402/SK_A_385	The feast of St Nicholas takes place in December. In the Netherlands, it has been celebrated in the same way for centuries. Good children receive gifts from the saint. The little girl in the foreground, for instance, has a bucket full of treats. Naughty children, like the wailing boy at the left, get only a switch (a bundle of twigs) in their shoe. Jan Steen was a born storyteller. He succeeded in incorporating all of the elements of the popular feast in this picture.
http://data.europeana.eu/proxy/provider/90402/SK_A_2329	The composition of this still life is both sumptuous and inventive. Mignon set the roemer, the green glass at the left, upside down. Reflected in it is a window, and a view of a church tower in Utrecht, where Mignon lived. The porcelain bowl from Asia was a sign of prosperity as well as being a showpiece on the table.
http://data.europeana.eu/proxy/provider/90402/NG_2010_40	The axiom ‘clothes make the man’ also held true in Indonesia. These are not actual portraits, but ‘types’. The accurately rendered garments and batik motifs indicate not only the region from which these men came, they also provide information about their rank and status. These resolute, confident figures are exceptional and were probably painted by a non-Western artist. In European depictions, Indonesians were usually depicted as adversaries, colonial subjects or ‘innocent’ primitives.
http://data.europeana.eu/proxy/provider/2063628/IRE_280_004	Irish artist Mainie Jellett studied under Walter Sickert at the Westminster School of Art, London.  In 1921, she and Evie Hone moved to Paris to train with cubist painters André Lhote and Albert Gleizes. Jellett first exhibited her non-figurative work in Ireland in 1922. She received much criticism but continued to act as an advocate for abstraction and in 1943 was central to the establishment of the Irish Exhibition of Living Art. Together with Hone, she is considered the doyenne of Irish Modernism. Her work featured in IMMA’s 2013 ‘Analysing Cubism’ exhibition.
http://data.europeana.eu/proxy/provider/90402/SK_A_4282	This canvas was commissioned by Pieter Sterthemius, director of the Hooghly trading post. The scene bustles with activity. Dutch East Indiamen navigate the Ganges River, the director of the trading post visits an Indian dignitary, and at the upper right an act of religious self-castigation is taking place: a man is suspended from a hook in his ribs and spun around a pole.
http://data.europeana.eu/proxy/provider/90402/SK_A_443	In composing this scene, Van de Velde relied on various preliminary drawings made from life. His superb skills as a painter of figures and animals were renowned in the 17th century, and he was regularly asked to paint the staffage in the landscapes and city views of other artists.
http://data.europeana.eu/proxy/provider/90402/SK_A_2317	"It is not certain whether Berchem ever travelled to Italy, but he excelled in rendering idealized scenes of the Italian countryside. His paintings were in great demand precisely because they included all the popular clichés: mountainous landscapes, warm light, hazy blue distances, bright skies and, of course, herders and
shepherds with their cattle and sheep at watering holes or resting in the cool shade."
http://data.europeana.eu/proxy/provider/90402/SK_A_44	"In 1667 Ferdinand Bol painted several life-size portraits of Michiel de Ruyter. These were hung in the headquarters of all five Dutch admiralties. This painting went to Middelburg. De Ruyter’s hero status made him a powerful man. In the portrait he is richly dressed and holding his commander’s baton. Around his neck
he is wearing the Order of St Michael, awarded to him by the King of France."
http://data.europeana.eu/proxy/provider/90402/SK_A_3419	"Cosimo Rosselli was a successful independent master and teacher whose work is typical of artistic production in Florence during the second half of the 15th century. This Nativity scene, which has survived in remarkably good condition, is representative of the Florentine feel for design and colouration, while also showing Rosselli’s reaction to recently imported
works by Flemish painters."
http://data.europeana.eu/proxy/provider/90402/SK_A_4011	"Daniele Barbaro was a leading scholar of Aristotelian physics. He is shown in the ecclesiastical garments of a patriarch. Next to him is his translation of the treatise on architecture by the ancient Roman Vitruvius. The book was published in 1556 with illustrations by the renowned architect Palladio. The latter frequently collaborated with Veronese, the painter of this portrait,
notably on Barbaro’s villa at Maser."
http://data.europeana.eu/proxy/provider/90402/SK_A_672	This old woman is seated with a book in her lap. She has just removed her pince-nez. Is she pausing for a moment or has she dozed off? The book in the woman’s hands and her wrinkled skin stand out in this small and otherwise dark painting. Metsu did this to underscore the essence of this popular subject – the contemplation of devotional texts, with a focus on the transitoriness of life.
http://data.europeana.eu/proxy/provider/2063605/LAT_280_001	In 1870, after successfully taking part in the Paris Salon, Kārlis Huns went to Normandy and then to Belgium where, it is thought, he painted the “Young Gypsy Woman”. This type of work by the artist – single figure genre compositions – was highly regarded. The fragile figure of the young gypsy, her pleading gaze, the raised tambourine against the falling coin – all the elements add up to a concentrated and sympathy evoking narrative, in which a social tint has been added to the romantic motif. In line with the academic tradition, everything in the painting has been carefully considered and purposefully realised using the artistic means of expression available to the author.
http://data.europeana.eu/proxy/provider/90402/SK_A_607	"Prince Frederick Henry and his cousin Count Ernst Casimir pose triumphantly on their horses before
’s-Hertogenbosch. Frederick Henry points his commander’s staff at the Habsburg-occupied city now being stormed by Dutch forces. It was not for nothing that he was nicknamed ‘the conqueror of cities’. He captured a series of cites from the Spanish. The retaking of ‘s-Hertogenbosch in 1629 was one of the most important."
http://data.europeana.eu/proxy/provider/90402/SK_A_4908	"The two painters produced this portrait to commemorate their youngest brother, Moses, who was born
in 1645. Moses died in 1667 during the storming of Fort Languard near Felixstowe in England. He had served in the Dutch navy against the English since 1664. In the painting Moses is surrounded by symbols that allude to his military life: time (the pocket watch), death (the skull), eternity (the ivy on the rocks) and loyalty
(the dogs)."
http://data.europeana.eu/proxy/provider/2063623/GER_280_007	The “Sistine Madonna” is one of most famous Renaissance artworks in the world. Raphael painted the altarpiece in 1512/13 in Rome. It was commissioned by Pope Julius II, who send the picture as a gift to the monastery church San Sisto in Piacenza (a small town southeast of Milan). The open curtains reveal a vision: The Virgin Mary is carrying the Infant Jesus from Heaven down to Earth. St Sixtus is kneeling on the left side, on the ride side St Barbara. Raphael included both of them in the painting because they were venerated at the high altar in the church. During the final stage of his painting process the artist invented the two cherubs at the bottom of the “Sistine Madonna”. After two years of negotiations Augustus III, Elector of Saxony and King of Poland, acquired in 1754 the “Sistine Madonna” for Dresden’s gallery. At the end of World War II the Soviet ‘trophy brigades’ removed the painting to Moscow. Only in 1956 returned the “Sistine Madonna” to Dresden’s Old Masters Picture Gallery.
http://data.europeana.eu/proxy/provider/90402/SK_A_2002	A Greek bride sits on a low platform, surrounded by family and friends. Her mother and mother-in-law welcome visitors. The bride receives gifts of gold jewellery and sumptuous cloth from her guests. In keeping with sumptuary laws (dress codes), the women do not wear veils inside the house. It is impossible to distinguish between the Greek and Turkish women based on their indoor attire.
http://data.europeana.eu/proxy/provider/90402/SK_A_1662	"Cornelis Evertsen the Youngest (1642–1706) came from a true seafaring family. Like him, his father and uncle
were both lieutenant-admirals. All three served the Admiralty of Zeeland, an important part of the Dutch
navy. Evertsen was also a fervent supporter of the House of Orange, as his sash reveals. The cannon and
the naval battle scene refer to his professional career."
http://data.europeana.eu/proxy/provider/90402/SK_A_4100	In 1792, the merchant Gildemeester converted two large rooms in his house on Amsterdam’s Herengracht into a picture gallery. Here we see that the walls are densely hung with paintings in gilded frames. Gildemeester stands in the middle of the front room, conversing with one of his guests. The visitors are studying the famous works, including a Rembrandt, visible above Gildemeester’s head.
http://data.europeana.eu/proxy/provider/90402/SK_A_3780	The highest-ranking Dutch East India Company (VOC) official in Asia was the governor-general. He presided in the Castle of Batavia (now Jakarta, Indonesia), a fort built by the Dutch. The assembly hall in the Castle of Batavia was the centre of Dutch power in Asia. The walls were hung with portraits of all of the governors-general. Most of the 18th-century examples shown here were painted in Asia, often by anony¬mous artists.
http://data.europeana.eu/proxy/provider/90402/SK_A_4078	The actual audience was held in the sultan’s private living quarters in the palace. After the meal with the grand vizier, Calkoen and his retinue were presented with kaftans as a sign of hospitality, but also to cover the clothing of the ‘non-believers’. Ahmed sits on a throne, with four princes next to him. Calkoen is giving a speech and will afterwards present his credentials to the sultan.
http://data.europeana.eu/proxy/provider/90402/SK_A_3948	This portrait invites us to enter the room and enjoy art and music with this gentleman. Typical of the 18th century is the lack of distance between sitter and viewer: the likeness is not intimidating. We stand face to face with a cheerful young man, member of a wealthy Mennonite family from Amsterdam. The visit has caught him unawares: on his shoulder are traces of powder spilled while he powdered his wig.
http://data.europeana.eu/proxy/provider/90402/NG_2010_41	The axiom ‘clothes make the man’ also held true in Indonesia. These are not actual portraits, but ‘types’. The accurately rendered garments and batik motifs indicate not only the region from which these men came, they also provide information about their rank and status. These resolute, confident figures are exceptional and were probably painted by a non-Western artist. In European depictions, Indonesians were usually depicted as adversaries, colonial subjects or ‘innocent’ primitives.
http://data.europeana.eu/proxy/provider/90402/SK_A_3746	The protagonist in this scene, John the Baptist, the forerunner of Christ, stands partially concealed in the shade of a group of fanciful trees. It is as if Bloemaert wanted to prove that he could paint virtually anything and everything: a mountainous landscape, leafy trees, as well as figures, either nude or clad in exotic colourful gowns and arranged in complicated poses. All of this proves him to be a master of Mannerism.
http://data.europeana.eu/proxy/provider/90402/SK_A_2115	Cleopatra made a bet with Mark Antony on who could give the most lavish banquet. She won by dissolving a priceless pearl in vinegar and then drinking the mixture. De Lairesse painted this story like a scene from a play, situating the figures clad in antique costumes in a fitting décor of Classical architecture and furniture. His classicizing style breathed new life into Dutch painting.
http://data.europeana.eu/proxy/provider/90402/SK_A_4040	"Slouching in his chair, with his breeches open, the man blows smoke from his pipe through his nose. His eyes are glazed, as though he is in a stupor. In the 17th century smoking had fervent supporters as well as opponents. Some scholars held that tobacco smoke was therapeutic for both body and spirit; others were
convinced that pipe-smoking was as harmful as excessive drinking."
http://data.europeana.eu/proxy/provider/90402/SK_A_3753	Leading a 120,000-strong army, the French king Louis XIV invaded the Netherlands on 12 June 1672. Glorifying Louis XIV, the Flemish painter Van der Meulen recorded the military manoeuvre. However, the artist took some liberties: at the time, the King – portrayed here on a grey horse – was actually staying at a nearby monastery.
http://data.europeana.eu/proxy/provider/90402/SK_C_1596	The taste for delicate, subtly coloured scenes set against gold backgrounds lasted longer in Siena than in Florence. This work – remarkable for the dramatic isolation of the crucified Christ between his followers (at right) and his persecutors (at left) – was probably the middle in a series of predella panels of the Passion of Christ placed beneath a large altarpiece.
http://data.europeana.eu/proxy/provider/90402/SK_A_1864	At the time of the Hague School, the French painter Courbet enjoyed a certain notoriety. He styled himself as a rebel and refused to align himself with any spe-cific style. Instead he began a one-man movement: ‘Realism’. He tried to render the ruggedness of nature by applying the paint to the canvas spontaneously, often with a palette knife. He painted these cliffs in the Jura Mountains in the vicinity of his native Ornans.
http://data.europeana.eu/proxy/provider/90402/SK_A_198	"In Greek mythology, satyrs – half-men and half-goats – were said to live in the woods and mountains. In
17th-century literature, they dwelt in the pastoral paradise of Arcadia, where one could lead a carefree life. The satyr here is presented as a shepherd of goats and sheep. He looks up from playing his flute to smile at the viewer."
http://data.europeana.eu/proxy/provider/90402/SK_A_645	From 1807 to 1809 Kleijn worked in and around Paris. Two of his landscapes from this period reveal his gratitude to Louis Napoleon. The King had bought two châteaux at Saint-Leu-la-Forêt, while his brother Napoleon owned the Château de Saint-Cloud (portrayed in the companion piece). Although this picture received great praise, it was also criticized for being too detailed and realistic. Kleijn did indeed take a grander approach in his view of Saint-Cloud.
http://data.europeana.eu/proxy/provider/90402/SK_A_3585	Using thick layers of dark paint, Breitner depicted traditional wooden boats. They seem to be robust and indestructible, but are stuck in the ice. Looming up behind their masts are large steel steamships painted in lighter, almost transparent colours. They sail in open water. Old and modern times are thus contrasted.
http://data.europeana.eu/proxy/provider/90402/SK_A_4000	Giovanni da Milano introduced richer colour and a more refined style to Florentine painting of the late 14th century. This is seen in the graceful silhouettes of the figures against the traditional gold ground. The panel was probably painted for someone with a special connection to the saints depicted: Francis, Mary Magdalene, the Virgin Mary, John the Evangelist and Ignatius of Antioch.
http://data.europeana.eu/proxy/provider/90402/SK_A_501	This painting is an ode to chastity. The Virgin sits in an enclosed garden, a symbol of virginity, surrounded by four other virgins (‘virgo inter virgines’). From attributes on their necklaces, they are identifiable as Saint Catherine with a wheel and sword, Saint Cecilia with an organ, Saint Barbara with a tower and Saint Ursula with a heart and arrow.
http://data.europeana.eu/proxy/provider/90402/SK_C_1698	With four horses, five dogs, two cows and eleven people on board, this slender ferry appears to be heavily loaded. The boats in the distance are also crowded with passengers. Salomon van Ruysdael was the interpreter par excellence of the flat, watery Dutch landscape. Here he used a tried-and-tested compositional formula: at right, a bank lined with tall trees, and at left, a body of water stretching out to the horizon.
http://data.europeana.eu/proxy/provider/90402/SK_A_2851	The Old Testament tells the story of the people of Babel who wanted to build a tower that would reach to heaven. God punished them for their pride: he confused their common language so they could no longer understand one another. This is one of the earliest painted depictions of this story; it also affords a fairly reliable glimpse of late medieval building practices.
http://data.europeana.eu/proxy/provider/2063623/GER_280_003	The idea of a spring that brings back youth to aging people, is known from antiquity to our days. In this paintings, the most famous pictorial formulation of the theme, Cranach builds on topics from medieval imagination.  From the left old women are brought to undress, get into the water and be reconverted right in the middle of the basin to young girls. On the right side they climb out of the bath, then dress up nicely and enjoy together with handsome men the pleasures of the dance, the table and love. Only the women have to enter the pool, while the men on the left side, who are also old and frail, are transformed by the affection of their companions. But the ultimate cause of rejuvenation is earthly love, represented by the Venus figure on the fountain-heading the center of the basin.
http://data.europeana.eu/proxy/provider/90402/SK_A_3920	The man leans out of a window. In his right hand he holds up a gold ring set with a stone. His left hand rests on a touchstone, an instrument for assessing the purity of gold and silver objects. The sitter might be the goldsmith Bartholomeus Jansz van Assendelft. In 1617, the year the portrait was painted, he was appointed assay-master of the Leiden goldsmiths’ guild, which would explain the inclusion of the touchstone.
http://data.europeana.eu/proxy/provider/90402/SK_C_216	Two contemporaries had themselves portrayed by Rembrandt in historicizing costumes as characters from the Bible. The couple’s tender embrace is at the centre of this poignant painting: the man’s loving gesture is returned with a gentle caress. The figures and their poses agree with the study (No 67), only the figure of King Abimelech spying on them is missing. We, the viewers, assume his role as witnesses of their clandestine love.
http://data.europeana.eu/proxy/provider/90402/SK_A_2231	The French army, which had invaded the Netherlands at the request of the Dutch Patriots, had already reached Utrecht when Daendels, a Dutch general in French service, sent Krayenhoff to Amsterdam. He was to ask the city council to step aside so that a new –Patriot –government could be installed before the French arrived. The change of authority took place in Amsterdam that same evening, 18 January 1795.
http://data.europeana.eu/proxy/provider/90402/SK_A_4482	This bird’s-eye view of the Mollucan island of Ambon has a small portrait of its first Dutch governor, Frederik Houtman, at lower right. At centre is the Portuguese Fort Victoria, which was seized by the Dutch East India Company in 1605. The raid was prompted by the lucrative clove production. Houtman initially maintained good contacts with the Ambonese chiefs, but the company mounted punitive expeditions to prevent the sale of the spice to rivals.
http://data.europeana.eu/proxy/provider/90402/SK_A_654	After the defeat of Napoleon, the director of the Rijks-museum, Apostool, was responsible for retrieving the art that had been stolen from the Netherlands and taken to France. In 1816 he returned triumphantly with most of it. This portrait was probably made on that occasion. Apostool wears the order of the knighthood that he received. The catalogue in his hand, from the Musée Français in Paris, is open to the Dutch school.
