artwork	desc
http://lod.sztaki.hu/data/item/17389	['Az udvari festő Martin van Meytens állandó feladatköréhez tartozott a császár és császárné, a császári család tagjainak megörökítése. Tekintettel arra, hogy a képekből reprezentációs célokra, a különböző rezidenciák és intézmények díszítésére, a külföldi uralkodók és a főúri családok, diplomaták stb. megajándékozására, ünnepi alkalmakra rengeteg példányra volt szükség, e képmások a műhelyben sorozatban készültek, kivitelezésükben maga Meytens kisebb-nagyobb mértékben vett részt. Modell után többnyire egy-egy fejtanulmányt készíthetett, a császárnénak sem ideje, sem kedve nem volt a hosszadalmas portréüléshez. Az eredeti fej- vagy mellkép tanulmányt azután különböző beállításban, öltözetben, más-más kellékekkel használták fel a különböző császári portrékhoz. Az itt kiállított Mária Terézia portré, amely a királynőt a magyar koronával és jogarral ábrázolja, közel áll többek közt ahhoz az alakhoz, amely az 1754-ben készült nagy családi képmáson látható (Wien, Schönbrunn). A beállítás, a hajviselet, a ruhakivágás, a nyakfodornál viselt ékszer, a mellhez emelt jobb kéz tartása azonos. A mintául szolgáló tanulmányt Meytens és műhelye a Budapestin kívül még számos változatnál is alkalmazta.', 'Martin van Meytens as a court painter had the permanent task of painting the portraits of the Emperor and the Queen, as well as of the various members of the imperial family. Since the decoration of various residences and institutes, gifts to foreign sovereigns, aristocrats and diplomats and various festive occasions made necessary several copies of the imperial portraits, these courtly representations were made in series by the workshop, and Meytens himself played only a minor or greater part in their execution. He had no occasion to make more than a study of a head after the model the Queen had neither the time nor patience to sit for the artist for a long time. This original head  or bust sketch was copied with different poses, clothes and accessories for the different imperial portraits. The portrait of Maria Theresia exhibited here is very similar to her figure in the great family portrait made in 1754 (Vienna, Schönbrunn). Her pose, hairstyle, neckline, the piece of jewelry worn at the collar and the gesture of her right hand are all identical. The study which served for both pictures as a model, was copied several more times by Meytens and his workshop.']
http://lod.sztaki.hu/data/item/14900	"[""Berény formulated a theme which appears to be rather  insignificant in a monumental picture rich in emotions. In the picture, space is hardly deeper than required for the presentation of the interior. Props originate from everyday events of absolutely no esthetics: a junk-heap, a hen, and a fence.  Colours of golden yellow, light pink, dark brown and blue meet in such an intimate  harmony that we witness an esthetic experience of visonary power. Colours and artistry had always been Berény's strengths, but he used to adjust colours to the decorative appearance of forms. In the case of this picture, he summed up values of colours in a unity of tone spreading out in the picture. Lines and contours following forms are less emphatic than in his previous pictures. Forms so  far plain were filled with richer and richer details while the arrangement  was left secure.""]"
http://lod.sztaki.hu/data/item/19220	['The decorated coffin, mounted on four wheels, was used at Easter ceremonies. The detail represents a guard from the left side of the coffin.']
http://lod.sztaki.hu/data/item/15419	"['Georg Raphael Donner, one of the most prominent sculptors in 18th-century Europe, was employed by Archbishop Imre Esterházy in Pozsony (Bratislava), then the capital of Hungary. The high altar of the Cathedral in Pozsony was his most significant accomplishment; under a baldachin, the mounted figure of St. Martin, titular saint of the church, was depicted sharing his cloak with a beggar seated on the ground. The sculpture bore the features of the doner, Imre Esterházy, and wore a typically Hungarian costume. The scene was watched by two large ""Adoring Angels"". The Baroque high altar was dismantled during the 19th century; the groups of St. Martin and the beggar today stands in the side aisle of the church, while the two angels are in the Hungarian National Gallery.\n\nThe angels were molded in 1733-1735, and represent the artistic development of Donner starting from Baroque tradition and arriving at a more individual Neo-Classical style. The high altar was cast in alloy of lead and tin - a material often used by Donner. The artist was helped by a number of assistants in the process of casting. The experience of these helpers and the direct example of his sculptures in Pozsony had a major impact on the development of Hungarian Baroque sculpture.']"
http://lod.sztaki.hu/data/item/19210	['The coffin comes from Garamszentbenedek. The decorated coffin, mounted on four wheels, was used at Easter ceremonies. Above the coffin a baldachin was erected with the standing figures of the 12 Apostles. (Presently only 10 are original.) The sides of the coffin is decorated by reliefs made after engravings by Martin Schongauer.']
http://lod.sztaki.hu/data/item/19503	"[""These kneeling statues of Pál Esterházy (1635-1713) and his wife, Orsolya Esterházy (?) (1641-1682) are considered, on the basis of their pose and gestures, sepulchral statues. Originally they were complemented by another couple of statues, that of Pál's brother Ferenc (\x861683) and his wife, Kata Thököly (\x861701) (Hungarian National Gallery). All four are kneeling on cushions, their look drawn to the sky, with hands joined, and in slightly bended, praying pose. The statues are composed on a frontal view. Their backs are grooved, and their feet reaching back are not perfectly carved, a sign that the statues were designed for wall-niches. Pál Esterházy is represented in somewhat historizing clothes (coat-of-arms and short shirt), with a wig, and the Order of the Golden Fleece, which he obtained in 1681. His wife wears Hungarian apparel, flowered shoulder stays, a peated-shoulder blouse, a girdle decorated with precious stones, and a necklace. Although the details of the statues, especially the soft folds of the woman's clothes and the modelling of the heads, are decorative and pleasant, the unknown sculptor, who surely was not one of the first-class masters of the period, did not manage to individualize his figures.\n\nThe statues were bought in 1849 by the Museum of Applied Arts, Budapest and, according to the seller's information, they originated from Pozsony. The represented persons were identified by Mária Aggházy, according to whom the statues were made not much after 1681, and were destined for bronze foundry workshop of Balthasar Herold in Vienna. They served as cast moulds for a bronze tomb which, because of Herold's death in 1683, was never realized. On the basis of their stylistic features, Aggházy considered the master of the statues to be Johann Christian Pröbstl, a Brünn burgher since 1682, who in 1720 also executed there the model of General Souches' bronze kneeling sepulchral statue. Her hypothesis was generally adopted by art literature.\n\nRecently discovered sources, however, somewhat modify this hypothesis. Indeed, the four wooden statues represent the Esterházy brothers (Pál and Ferenc) and their wives, and were certainly made on Pál's commission. However, they were not cast moulds, but statues for the Esterházy Mausoleum, which was connected to the cloisters of Kismaton's (Eisenstadt) Franciscan church. Although the Esterházy family had a sepulchral place of their own in Nagyszombat's (Trnava) Jesuit church built by the father of Pál, Palatine Miklós Esterházy, its crypt proved damp, so Pál Esterházy wanted to build a mausoleum in the same church, as is attested by his will of 1678. According to his plans, this was a two-level sepulchral chapel with a lower tomb-level, and an altar on each floor. The two levels were bound by a lattice window, through which the tombs at the lower level were seen from the upper one. The model for this may have been the Archduke Mausoleum in Graz, where, at the Jesuit school, Pál Esterházy began his studies. However, in the end Pál Esterházy built his family mausoleum not in Nagyszombat, but in residence of his estates, in Kismarton's Franciscan church. He himself was buried here. Although the crypt was completely rebuilt in 1856-57 when it obtained its current forms, its previous appearance can be reconstructed on the basis of a detailed description of the interior from 1835-36.""]"
http://lod.sztaki.hu/data/item/16327	"[""Sculptors Márton and György (Martin and George) Kolozsvári were the sons of Miklós, a painter in Kolozsvár. They belonged to the excellent bronze casting workshop in Nagyvárad and their activities elevated Hungarian bronze sculpture to the European level in the third quarter of the 14th century. Their first achievements were the statues of the Hungarian Saint Kings executed c. 1360-70 for the Cathedral of Nagyvárad. These statues were destroyed during the Turkish occupation.\n\nTheir masterpiece, the equestrian statue of Saint George executed in 1373, can be considered as a forerunner of the Italian Renaissance equestrian statues of the 15th century. It was sent to Prague as a gift of Hungarian Angevin King Lajos the Great to Emperor Charles IV.\n\nIn 1390 they executed the over life-size equestrian statue of Saint László, commissioned by the Bishop of Nagyvárad. It is assumed that the reliquiary of Saint László's head in the Cathedral of Győr is a copy of the head on this equestrian statue and it was made by the older brother, Márton.""]"
http://lod.sztaki.hu/data/item/17406	"[""The Holy Spirit church in the city of Sopron has two side-altars. One is the Holy Cross altar, about which the 1782 contract drawn up with the painter, István Dorffmaister and the sculptor, Ferenc Müller has remained to us. The other is the Pieta altar decorated by the picture exhibited here. Very early in the year 1783 a cabinet-maker was paid for having dissembled and reassembled the high altar and the two sidealtars in 1782. One of the (old) side-altars may have been the Pieta one whose altarpiece was perhaps made at the same time with the high altar's painting (cat. no 108Ö, as its technique of execution suggests. We consider both that altarpiece and this side-altarpiece as works made in the 1750's by Joseph Ignaz Mildorfer.\n\n18th century Pieta compositions usually feature few figures: in most of them, there is but an angel to share the grief of Mary shown broken over her dead son. However, the Sopron altarpiece was composed by its painter from five figures, arranging St. John supporting Mary, Mary Magdalene wiping Christ's wounds and a woman embracing his hanging arm around the central figure of Christ himself lying in her mother's lap. The picture's basic tone is grim and dark. Its figures are almost bodyless. Glaring lights illuminate the faces depicted in sharp foreshortening and some widely fluttering draperies that make the composition almost burst. The figures of the windblown vision are mostly linked by the strange expressive forms of the strongly accentuated hands in a feature characteristic of Mildorfer's art in the style of the 1750s. His painting at Sopron is not related to his early Pieta (St. Moritzen bei Telfs, 1742) but rather to the sketch at Graz, similarly unquiet in the intensity of expression (Graz, Joanneum). Here again, similarly to many other works of his. Mildorfer set out from a composition by Troger: his figure of Christ is almost a paraphrase of Troger's Pieta in Vienna (Historisches Museum der Stadt Wien), yet without the latter's power of plasticity and confidence of composition. Unlike the high altar's painting at Sopron, this picture was not attributed to Dorffmaister and got its only mention in Sopron's topography referring to it as a painting close to Franz Sigrist."", 'A soproni Szentlélek-templomban két mellékoltár áll. A szentkereszt-oltár, amelyről fennmaradt a festő Dorffmaister István és szobrász Müller Ferenc szerződése 1782-ből, s a Pieta-oltár, amelyet a kiállított kép díszít. Az 1783-as év legelején pedig azért fizettek az asztalosnak, hogy a templomban a főoltárt és a két mellékoltárt 1782-ben szétszedte és újra felépítette. Az egyik ""régi"" mellékoltár a Pieta-oltár lehetett, amelynek oltárképe, formajegyei alapján, egyidőben készülhetett a főoltárképpel. S miként azt, úgy e mellékoltárképet is Joseph Ignaz Mildorfer 1750-es években készült alkotásának tartjuk.\n\nA 18. századi Pieta-kompozíciók általában kevésalakosak, s a halott fiát sirató Mária gyászában legtöbbször csak egy-egy angyal osztozik. A soproni oltárképet viszont a festő öt alakból komponálta, s az anyja ölében fekvő Krisztust a Máriát támogató Szent Jánossal, a Krisztus sebeit letörlő Mária Magdolnával s lehajló karját átölelő asszony alakjával vette körbe. Komor, sötét a kép alaptónusa. Figurái már-már testetlenek. Az éles fények a kompozíciót szinte szétfeszítő, szélesen lobogó drapériákat s erős rövidülésben ábrázolt arcokat világítanak meg. A szélfútta látomás alakjait leginkább az erősen kihangsúlyozott kézfejek, különös, expresszív formái kötik össze, mindez Mildorfer művészetében az 1750-es évek stílusának jellegzetessége. Soproni festménye nem korai Pietá-jának (St. Moritzen bei Telfs, 1742) rokona, sokkal inkább a kifejezés intenzitásában hasonlóan zaklatott grazi vázlaté (Graz, Joanneum). Itt is, mint annyi képen, Mildorfer Troger-kompozícióból indult ki. S Krisztus figurája Troger bécsi Pietájának (Historisches Museum der Stadt Wien) valóságos parafrázisa, csak éppen annak plasztikai ereje és kompozíciós biztonsága nélkül. A képet - eltérően a soproni templom főoltárképétől - nem sorolták Dorffmaister alkotásai közé, s említeni is csupán a soproni topográfia említi, mint Franz Sigristhez közeálló festményt.']"
http://lod.sztaki.hu/data/item/18549	"['The subject matter of mourning has a literary portrayal in János Thorma\'s pictures. The scene in a graveyard shows that death is not particular about anybody and that mourners have preserved signs of their privileged status. The lady in black cannot avoid kissing the baby of the peasants at a moment of charity. The man wearing a hat and gloves is holding a handkerchief to the mouth, the autumn fog is choking him, but his eyes show that he is leaving the graveyard in thoughts. Peasant women are standing as if Fatal Sisters, probably by graves of soldiers.\n\nThorma had been returning to the  subject matter of ""Rise Up, Hungarians"" for several decades, going through  the history  of 1848 which he managed to recall in some sketches, but his phantasy failed when this picture was to be painted.']"
http://lod.sztaki.hu/data/item/14839	"['Benczúr\'s early landscapes, i.e. those made between 1873 and 1875, often feature figures, mostly that of his wife. When she died in 1890, leaving behind four orphans, sadness moved into the Benczúr\'s home. The painter married again two years later, and the newly discovered family harmony reappeared in his compositions. This particular painting, too, shows the artist\'s second wife delighting in the abundant beauty of the natural surroundings.\n\nIn another of his works, painted in 1890 and entitled ""Among Mallows"", there are amorettes of Rubenite roundness surrounded with floral decoration on similar Baroque pomp. In the case of this particular painting, however, the mythological references, which were typical in the painter\'s later works, are missing: the harmonious relationship between man and Nature is depicted directly. Employing the entire artistic vocabulary of European painting in a masterly way, but substituting the brilliant surface of Impressionism with the partiality to details of Naturalism, the painter makes a sincere statement about the love of life and the faithful attachment to his spouse.']"
http://lod.sztaki.hu/data/item/17888	['Perlrott Csaba studied with Matisse in Paris in 1905, however, the influence of Cézanne became decisive in his art. In 1911 he travelled to Spain where he was strongly influenced by El Greco. In his Adoration of the Magi the two influences are present simultaneously.']
http://lod.sztaki.hu/data/item/19233	"[""The relief was probably executed by Tommaso Fiamberti Florentine sculptor, one of the pupils of Desiderio Settignano. It is assumed that the relief decorated the top of the portal of the chapel in King Matthias's summer palace at Visegrád.""]"
http://lod.sztaki.hu/data/item/19508	"['The statue of this popular herdsmen\'s saint came to the museum from the art trade. Its provenance is unknown. The saint\'s only attribute is the sack on his side; the stick from his hand and the hat from his head have been lost. His fancy folk costume recalls the costumes of pastoral plays. His emphasized ""contrapposto"" and a strong twist of his body is a general characteristic of the sculptural style of around 1760, but it also proves the figure to have stood at the side of an altarpiece.\n\nThis statue is essentially a mirrored counterpart of the figure of ""St. Florian"" in Nagykanizsa\'s Franciscan church, which is unanimously attributed to Joseph Straub (1712-1756). They are similar in their anatomical exactness (which, however, is less successful in the case of St. Wendelin), and the fine broken folds of their clothes. The affected expression of St. Wendelin\'s face, his eyes drawn to the sky and opened mouth are common details of the Straub brothers. The statue\'s surface, the gilding combined with colour of body, is also characteristic of Joseph Straub\'s Marburg (Maribor) workshop.']"
http://lod.sztaki.hu/data/item/19096	['The picture shows a detail of the most significant Romanesque church portal in Hungary. The west portal of the church at Ják is richly decorated and in the niches of the step-gable the statues of Christ and the Apostles can be found.']
http://lod.sztaki.hu/data/item/18628	"['Uitz a vörös takarón fekvő, plédbe burkolódzó, alvó nőalakot már a Tanácsköztársaság bukása utáni ""csendben"" festette. Életszituációjából érthetően vált ekkor Uitz művészetének egyik fő témájává a kendőbe vagy plédbe burkolódzott modell ábrázolása, ami az emigráció első évében, Bécsben született rézkarcainak egész során visszatér. A Fekvő nő ezeknek az 1920-as munkáknak az előzménye, feltehetően a magyarországi alkotóperiódus utolsó festménye, s egyúttal Uitz olajképei közül a legismertebb. A reneszánsz Vénusz ábrázolásokra is visszautaló témájában és fénnyel modelláló plasztikus megoldásában, kompozíciós zártságában jól mutatja e kép, hogyan élt tovább a tradíció szelleme a művészben az izmusok problémáival való kísérletezés mellett.', 'After the fall of the Hungarian Soviet Republic Uitz began to paint the figure of the sleeping woman lying on a red rug and with a cover over her. Changes in his life explain why he started to paint models who had a cover on them which returns in series of copper engravings during the first year of his emigration in Vienna.  ""Reclining Woman"" is a forerunner of works of 1920, and was probably the last picture of his artistic period in Hungary. It is the best known of Uitz\' oil paintings. The picture demonstrates clearly with the subject matter recalling renaissance Venus portrayals, with the way light is applied to model plasticity  and with its composition that the spirit of tradition survived  in the artist while he was experimenting with various isms.']"
http://lod.sztaki.hu/data/item/15820	"['Sötét háttérből emelkedik ki a kellemes külsejű, simára borotvált arcú fiatalember mellképe. Tekintetét kissé elmerengve a néző felé fordítja. A kor divatjának megfelelő Vatermörder nyakravalót, kihajtott gallérú barna kabátot visel. A beállítás közvetlen, egyszerű, a finoman árnyalt színezés kellemes összhangot kölcsönöz a képnek. A barokk udvari portré színpadias beállításából, retorikájából itt már semmi sem érződik, stílusában, felfogásában Goez portréja a német arcképfestők, Anton Graff, Dorothea Therbusch józan polgári szemléletéhez, őszinteségéhez igazodik. Képünk valószínűleg azonos azzal az Önarcképpel, melyet Goez életrajzírója, E J. Lipowsky a leopoldskroni Firmian kastélyban említ s amelyet a képmásgyűjtemény jegyzékében de Goez Baron nevén tartottak számon. Hasonlóan több más festő önarcképhez a gyűjtemény felbomlása után ez a képmás is Budapestre került. Ezt az összefüggést látszik megerősíteni a többi képpel - Rugendas, Purgau stb. - megegyező méret s a hasonló felirat.', ""This bust portrait of the smooth-shaven, pleasant-looking young man emerges against a dark background. He turns his contemplative eyes on the spectator. His Vatermörder neckerchief and brown coat with its collar turned down match the fashion of the time. His simple, unreserved pose and the fine-tinted colouring ensures the pleasant harmony of the picture. Nothing is felt here of the theatrical poses and rhetoric of Baroque courtly portraiture. With the style and artistic approach of this portrait Goez followed the sober bourgeois view and sincerity of such German painters as Anton Graff or Dorothea Therbusch. This portrait probably can be identified with the self portrait which, according to Goez's biographer, E E Lipowsky, was conserved in Leopoldskron's Firmian Mansion, and was listed in the collection's portrait lists as de Goez Baron. As with to other painters' self portraits, this one also came to Budapest after the dispersal of the collection. This is confirmed by the picture's dimension and type of inscription, which are similar to those of the other self portraits (Rugendas, Purgau etc.).""]"
